URL,Title,Authors,Text,TF_IDF_Summary
https://www.bbc.com/worklife/article/20240112-taylor-swift-could-be-the-push-the-vr-industry-needs,Taylor Swift could be the push the VR industry needs,['Author not found'],"Taylor Swift could be the push the VR industry needs

By Jared Lindzon Features correspondent

Getty Images

Swifties represent a market of highly engaged music fans who could flock to VR for experiences (Credit: Getty Images)

As virtual reality companies hunt for ways to spread their tech, they may find an unexpected audience for wide-scale adoption: Swifties.

The unprecedented popularity of Taylor Swift's Eras Tour has inspired fans to spend thousands on tickets, while its cinematic debut broke box office records. Now, some experts in the virtual reality (VR) space are hopeful it will also inspire her fans – ""Swifties"" – to adopt the immersive technology platform.

Along with stadiums and cinemas across the globe, The Eras Tour is also streaming on Amazon's Prime Video app. Soon after its release fans discovered that, like much of Prime Video's content library, they could stream the film in their own private virtual theatres through Prime Video's VR app on a Meta Quest.

On TikTok and other social media platforms, videos of Swifties singing along while wearing the headsets have gone viral. This has led some industry insiders to suggest the cinematic experience of the top grossing tour in music history could also catalyse the mass adoption they've been clawing for.

Getty Images

The Meta Quest 3 is available at $499 (£391) – a more accessible price than past tech (Credit: Getty Images)

Technological limitations have fed into this slow uptake, but prohibitively high costs have also been a major factor. It wasn't until 2016 when the Facebook-acquired Oculus Rift became the first commercially-viable VR product, hitting store shelves at $600 (£470). Prices have since come down: the mixed-reality headset Meta Quest 3, released in October 2023, is priced at $499 (£391); its predecessor, the Meta Quest 2, is widely available at $249 (£198). (Other VR headsets are still extremely expensive: Apple's Vision Pro, launching February, begins at $3,499 (£2,741).)

Typically, the cost of attending a concert is a fraction of a new piece of hardware, but the Eras Tour has flipped that equation on its head. With resale tickets averaging more than $3,800 (£2,977) each, VR-industry insiders say there's reason to believe Swift's unprecedented popularity could finally provide an answer to the barriers of both content and cost.

""Buying a VR headset for $400 might sound unreasonably high, but if you think about buying it as an alternative to experiencing a Taylor Swift concert… $400 sounds like a reasonable alternative,” says Rolf Illenberger, the CEO Munich-based VRdirect, which helps organisations create virtual experiences. ""The price point for a Taylor Swift fan is not a limiting factor to watch the superstar over and over again in this immersive experience.""

Taylor Swift is a killer app for virtual reality. It was a big signal to me, and really reaffirmed that powerful IP is a necessary ingredient to attract folks to a brand-new device category – Tom Emrich

Now that VR headsets are more functional and affordable, many in the field believe the main missing ingredient is a piece of software or content so popular it inspires the average person to purchase a new hardware device.

""Taylor Swift is a killer app for virtual reality,"" says VR expert and unabashed Swiftie Tom Emrich, who was ecstatic to see his two passions collide on social media over the holidays. ""It was a big signal to me, and really reaffirmed that powerful IP is a necessary ingredient to attract folks to a brand-new device category.""

Emrich, 45, who serves as the director of product and augmented reality platforms for San Francisco-based Niantic Labs – the company that brought the world Pokémon Go – notes that The Eras Tour Concert Film was filmed in 2D, not VR with cameras. Instead of immersing fans in a concert experience that makes them feel like they're sitting front row, he says the experience is more like being immersed in a movie theatre, with the Eras Tour film playing on screen.

""That's just the base level experience that you're going to be able to get in virtual reality,"" he says. Simply, this means content will only get better as events are captured using 3D filming technology – such as a 2023 Megan Thee Stallion concert experience, or an upcoming Doja Cat event – which were designed to make fans feel like they're standing on stage next to their favourite artist.

Getty Images

Taylor Swift fans are experiencing The Eras Tour on VR, and it's getting them even closer to their favourite superstar (Credit: Getty Images)

""I'm really excited for Swifties to eventually be able to experience Taylor Swift concerts made for VR,"" says Emrich. He adds that no such project has been confirmed, but says he remains optimistic one will emerge, given how excited fans were to watch the 2D version in VR.

The industry has tried to spark mass adoption through entertainment before. In recent years, live sporting events in VR have been met with similar excitement, but ultimately little uptake. In March 2023, for example, ESPN shared a TikTok video of a fan enjoying a courtside perspective of a live National Basketball Association (NBA) game from their living room. Despite racking up more than four million views and more than 330,000 likes on TikTok alone, it did not trigger mass adoption among sports fans.

Illinberger, however, argues that concerts are better suited to the medium. That's because, unlike a live sporting event, they can be edited and touched up with CGI after filming to enhance the viewer experience. Plus, sporting events are filled with stops and starts, during which time fans often chat with each other, use other devices, eat and drink or use the toilet, none of which is convenient with a headset on.

""For concerts like Taylor Swift… it comes back to immersive-ness,"" he says. ""The Taylor Swift fan wants to experience the concert as much as possible, and that's what VR can deliver.""","Now, some experts in the virtual reality (VR) space are hopeful it will also inspire her fans – ""Swifties"" – to adopt the immersive technology platform.
Along with stadiums and cinemas across the globe, The Eras Tour is also streaming on Amazon's Prime Video app.
Taylor Swift is a killer app for virtual reality.
""For concerts like Taylor Swift… it comes back to immersive-ness,"" he says.
""The Taylor Swift fan wants to experience the concert as much as possible, and that's what VR can deliver."""
https://www.bbc.com/travel/article/20240115-the-european-city-where-selfies-are-awkward,The European city where selfies are 'awkward',['Author not found'],"The European city where selfies are 'awkward'

By Kate Bettes Features correspondent

Amelie Stanescu

(Credit: Amelie Stanescu)

Want to take a selfie? In Berlin, where privacy, living in the moment and counterculture are highly valued, the answer may be ""no"".

It was 01:00, raining and just 2C, but Café Luzia was buzzing. The bar in Berlin's trendy Kreuzberg neighbourhood was alive with pre-club revellers wrapped up in big coats talking loudly in front of the graffitied mirrors and surreptitiously lighting cigarettes on open candles.

""Let's get a selfie!"" said a girl at our corner table, extending her arm to capture the group. She was from Paris, on her first trip to the German capital. We laughed and complied, edging together for the shot. As our group settled back, a friend – who has lived here on and off for years – said, ""It's quite funny; here in Berlin, it's not really done to take selfies.""

This wasn't the first time I'd heard this since coming to Berlin six months ago. Here, I've noticed distinctly fewer people posing with their phone cameras in public, with selfies seen as self-indulgent. In my hometown of Sydney, with its world-famous harbour and countless alluring beaches, selfies for social media feel like a fun addition to the everyday. In Berlin, it seemed much rarer.

It's not news that Germans more widely value their privacy to a high degree. According to 2017 research from the University of Hohenheim on attitudes, behaviours and perceptions of privacy, German citizens disclose personal information ""quite rarely"". And when it comes to sharing photos of themselves on social networks, such as a selfie on Instagram, the researchers found that ""only a few Germans"" found it ""useful"" to do so. ""The highest percentage [was] found among the youngest participants (7%),"" the report noted.

""Germany is one of those countries where privacy concerns are noticeably more pronounced,"" said Philipp Masur, co-author of the 2017 report and assistant professor at Vrije Universiteit Amsterdam, where he studies digital communication and the impact of social media on our daily lives. ""In [the former] East Germany, [pronounced state surveillance] may have led people to be slightly more concerned about issues related to privacy.""

Hinterhaus Productions/Getty Images

In Berlin, selfies are often seen as self-indulgent and it's less common to see people posing with their phones in public (Credit: Hinterhaus Productions/Getty Images)

Until the Berlin Wall fell in 1989, Berlin was split between the German Democratic Republic (GDR) in the East and the Federal Republic of Germany (FRG) in the West. As such, Berlin residents, as well as other residents of the GDR, were subject to extensive surveillance by the Ministry for State Security – also known as the Stasi.

Under surveillance? Today, visitors from the former GDR and beyond can visit Berlin's Stasi Museum as a reminder of the severely intrusive surveillance network, and even go to the Stasi Records Archive in Berlin to see if the Stasi had a file on them.

But while this history could go some way in explaining a contemporary concern over online privacy from state actors or even a lingering anti-capitalist distrust of large companies – and what they might be doing with data uploaded to their platforms – there may be more to this avoidance of taking selfies in public in Berlin.

Many Berlin residents I spoke to believe that their ""no-selfie"" culture developed via its famous club scene – whose hallowed venues seek to maintain an air of secrecy online and encourage partiers to revel in the moment. I'd been surprised when I first arrived in the city to see signs with a slashed cross through a camera at almost all the clubs I visited. But I've now got used to the fact that I cannot take photos inside and must either put my smartphone away or place a sticker over its lens.

That's because not only are Berlin's clubs home to some of the world's best techno music, but they are also considered an outlier in terms of what they provide for their patrons: a place where people are liberated to act in a way that is not always accepted in public. No more is this more obvious than in the nightclubs that market themselves as safe spaces, specifically created for the enjoyment of counterculture movements including the LGBTQI+ community, the kink scene and sex-positive groups.

Iain Masterton/Alamy

Berghain is one of many clubs in Berlin that has a strict no photo policy (Credit: Iain Masterton/Alamy)

Berghain (widely seen to have championed the no-photo rule when it brought it in, circa 2006), ://about blank and Sisyphos, remain the best-known clubs with an aversion to photography in Berlin. Another standout example is KitKat, a famously sex-positive club in Mitte. Here, guests are encouraged to wear fetish, patent and leather, glamour clothes and more, and are allowed to have sex on site.

""It's not a big mystery,"" said the official KitKat account, when I reached out to them on Instagram to ask why they don't allow photos inside, barring occasional, select events. ""The ban is on the one hand a protection of our guests, and… a protection of the atmosphere and concept of the club. Without it, most people would probably behave different[ly].""

In short, it's a way to allow their patrons to act out their desires without fears of repercussion in the outside world.

Marta Lodolr, a performance artist and nine-year Berlin resident, says she believes that for a major city in Europe, Berlin feels like a small city with a ""high level of freedom"" to enjoy the moment in shared spaces. ""There's so many things that can be [experienced] outside of the online world,"" she said, adding that it isn't just clubs that demand its patrons don't take photos. ""[It's] also [in] other places that, for respect of the people who go in, or for the respect of the place itself, selfies are not allowed.""

Indeed, this desire to live in the moment is something that's evident in other spaces in the city. In my frequent summer visits to ​​sunbathe at the popular Badeschiff pool on the River Spree, I'd seen signs at the entry saying photography wasn't allowed – a public digital detox I'd have thought unthinkable as a frequent Sydney beachgoer. And unlike music venues in most every other city, you'll almost never see a sea of people holding up their cameras to film musicians performing concerts in Berlin.

In addition, while there isn't an outright ban, Berlin is home to highly solemn post-war spaces – such as the Memorial to the Murdered Jews of Europe in Mitte – where photography is seen as highly inappropriate, if not forbidden.

Maremagnum/Getty Images

Berlin is home to highly solemn post-war spaces where photography is seen as highly inappropriate (Credit: Maremagnum/Getty Images)

""In London, I definitely see more people posting about day-to-day life things,"" said Claudia Hampton, a Berlin-based photographer and documentary filmmaker who is originally from London and believes casual self-documentation in Berlin isn't valued nearly as much as in the UK capital. ""When [a friend] is at the pub with a pint, or with their dog, you'll see it in their story. I don't see that that much [in Berlin].""

Hampton also says that in addition to Berlin residents finding it inappropriate or self-indulgent to post about their day-to-day activities, taking selfies here can simply be kind of awkward. ""People would think it's lame – but I do it sometimes.""

Could Berlin's values of privacy and freedom from photography be eroded by the increasing pressure in other cities for professionals to have an active online presence, I wondered? ""Basically I think that the city is becoming more [like] another European city,"" said Lodolr, referring to what she sees as a gradual shift away from more anti-capitalist attitudes in Berlin. ""Before, this kind of level of freedom was, let's say, spread in prices, rent and communities. More investors are interested in buying buildings in the city.""

Indeed, according to Masur, privacy concerns within Germany are getting more in line with other countries. ""One of my assumptions would be that it has to do with the advancement of globalisation. We're more exposed to other people, meaning [convergence] to a certain degree.""

Amelie Stanescu

Despite any awkwardness, Amelie Stanescu still takes selfies in public for social media (Credit: Amelie Stanescu)

Take Berlin-based fashion social influencer and businesswoman Amelie Stanescu, who frequently posts her selfies to 64,000 followers on her Instagram. ""People stare a lot in Berlin,"" she said to me over coffee in a trendy Prenzlauer Berg cafe, as we talked about the different social attitudes towards selfies between her adopted city of nine years and her Italian hometown. She says Berlin remains at the point where taking selfies in public is still seen as a little unusual.

I don't think they stare because they think you're doing something lame or whatever. I think they're just staring to see what you're doing

""I don't think they stare because they think you're doing something lame or whatever. I think they're just staring to see what you're doing.""

But she says that despite any awkwardness, she still takes selfies in public for her channels and to be successful in her job. ""I do it for work and I enjoy it,"" she said. ""At this point of my life and my career, I cannot think or consider other people's feelings when I do my work.""

It's an understandable and practical attitude in an increasingly international world that often requires visual self-disclosure for success. So, will these changes ever wear down this free-spirited city's aversion to selfies?

I hope not. I have grown to love Berlin's liberating attitude, which results in not feeling the pressure to document my night out or post to prove to others that I'm really having fun. Instead, my days – and particularly my nights out – have become cherished spaces in which to create memories worth remembering, and not ones where I need to take photos to do so.

Soul of the City is a series from BBC Travel that invites you to uncover the unique characteristics of cities around the world through the stories of the people who live there.

---

Join more than three million BBC Travel fans by liking us on Facebook, or follow us on Twitter and Instagram.","The European city where selfies are 'awkward'By Kate Bettes Features correspondentAmelie Stanescu(Credit: Amelie Stanescu)Want to take a selfie?
Here, I've noticed distinctly fewer people posing with their phone cameras in public, with selfies seen as self-indulgent.
In my hometown of Sydney, with its world-famous harbour and countless alluring beaches, selfies for social media feel like a fun addition to the everyday.
""Basically I think that the city is becoming more [like] another European city,"" said Lodolr, referring to what she sees as a gradual shift away from more anti-capitalist attitudes in Berlin.
She says Berlin remains at the point where taking selfies in public is still seen as a little unusual."
https://www.bbc.com/culture/article/20240116-has-mean-girls-lost-its-bite,Has Mean Girls lost its bite?,['Author not found'],"Has Mean Girls lost its bite?

By Scarlett Harris Features correspondent

Paramount

(Credit: Paramount)

The hit remake has been described as ""too nice"" compared to the 2004 original starring Lindsay Lohan – but does the new movie just offer its own, more contemporary version of meanness?

""This isn't your mother's Mean Girls,"" announces the trailer for the new musical-movie remake of the 2004 classic, which is currently topping the US box office. If ""not your mother's Mean Girls"" means it's a departure from the problematic jokes that were a hallmark of the noughties (and of Tina Fey, who wrote the original, the Broadway musical from which the new version is an adaptation of and this current iteration), then it certainly delivers on that promise for Gen Z.

More like this:

A quick, relatively spoiler-free rundown of some of the big changes: much of the cast are queer people of colour, including Damian (Jacquel Spivey) and Janis (Auli'i Cravalho), from whose perspective the story is told. Cady (Angourie Rice) has transferred from being homeschooled specifically in Kenya instead of the monolithic Africa (and Kevin G nicknames her ""Water Bird"" – in the original it is ""Africa""), and the different social groups aren't categorised by race. Damian sings the I, Carly theme song in French instead of Christina Aguilera's Beautiful at the Christmas talent show.

Alamy

The original Mean Girls movie (2004) featured Rachel McAdams, left, as the bully Regina George (Credit: Alamy)

The ""obsessed lesbian"" rivalry between Janis and Regina (Reneé Rapp) remains, though it is more fleshed out (perhaps owing to the bisexuality of the two actors who play them), with Janis being openly queer and Regina playing that up to appeal to the male gaze (when a game of spin the bottle in middle school requires that the two kiss, which leads to their falling out). The difference this time around is that Janis won't be shamed for her sexuality, and her trauma is that she lost her best friend, who was bullied and kicked out of school.

Regina is still a terrifying bully, perhaps even more so than McAdams's version because Reneé Rapp is legitimately scary

The humanisation afforded to its characters also extends to Regina. In the original, Regina was a fairly stock standard, one-dimensional villain, however well-played by the sorely underrated Rachel McAdams. The musical addition of Regina's songs, Someone Gets Hurt and World Burn, grant us insight into her motivations outside of having ""money and looks"". Someone Gets Hurt lets us see that her pride and her ""cold and forbidding"" persona are a ""performance/This is all self-defence,"" while World Burn reinforces her barriers after she is the one who gets hurt: ""This is what I get for helping… I wanna watch the world burn/And everyone get mean.""

Some might say that the Mean Girls redux is ""too nice"", but if the bar is Y2K-era insults then the bar is in very low indeed. There are none of the fat-shaming, homophobic or racist slurs, but Regina is still a terrifying bully, perhaps even more so than McAdams's version because Reneé Rapp is legitimately scary. (Just ask Buddy the bus driver.) The Burn Book crucially still exists, and thankfully it remains in analogue (""from that week [the teachers] took away our phones"") instead of on social media or as a text chain. Some of the updated insults don't quite land though: ""fat virgin"" is now ""horny shrimp"" and ""fugly slut"" is now ""fugly cow"".

As Jennifer Keishin Armstrong, author of the new book So Fetch: The Making of Mean Girls (And Why We're Still So Obsessed With It), writes, ""Now 'space-dyke' become[s] 'space-lez'. You can debate among yourselves how much that helps."" But owing to the much-needed diversity of the cast and characters, Tina Fey recently told The New York Times that ""Regina wouldn't try [some of the stuff from the original] now because she knows the kids around her would be like, 'That's homophobic.' She would know not to be homophobic, and hopefully, truly would not be homophobic.""

Fey goes on to say that what was considered normal ""mean girl"" teen behaviour in 2004 has permeated the culture and politics today. Though one could argue the same about the societal climate surrounding the original, this might not be your mother's Mean Girls, but it's certainly updated for a new generation.","Has Mean Girls lost its bite?
""This isn't your mother's Mean Girls,"" announces the trailer for the new musical-movie remake of the 2004 classic, which is currently topping the US box office.
Some might say that the Mean Girls redux is ""too nice"", but if the bar is Y2K-era insults then the bar is in very low indeed.
As Jennifer Keishin Armstrong, author of the new book So Fetch: The Making of Mean Girls (And Why We're Still So Obsessed With It), writes, ""Now 'space-dyke' become[s] 'space-lez'.
Though one could argue the same about the societal climate surrounding the original, this might not be your mother's Mean Girls, but it's certainly updated for a new generation."
