URL,Title,Authors,Text,TF_IDF_Summary
https://www.bbc.com/news/entertainment-arts-65823240,Tom Wilkinson: The Full Monty actor dies at 75,['Author not found'],"Tom Wilkinson: The Full Monty actor dies at 75

Watch: A look back at some of Tom Wilkinson's memorable performances

British actor Tom Wilkinson, known for films like The Full Monty, Shakespeare In Love and The Best Exotic Marigold Hotel, has died aged 75.

Wilkinson won a Bafta for 1997's The Full Monty, and reprised the role of Gerald when a Disney+ streaming series revisited the characters 26 years on.

He received six Bafta nominations in total as well as two Oscar nominations, for Michael Clayton and In The Bedroom.

He died suddenly at home with his wife and family, they said in a statement.

George Clooney, who starred with Wilkinson in the 2007 legal thriller Michael Clayton, praised the actor as ""the epitome of elegance"".

Paying tribute, he told Variety magazine: ""Tom made every project better. Made every actor better.

""He was the epitome of elegance and he will be dearly missed by all of us.""

With more than 130 film and TV credits in total, Wilkinson was as comfortable in period dramas like 1995's Sense and Sensibility and 2013's Belle, as he was playing criminal masterminds in movies like Rush Hour opposite Jackie Chan in 1998, or Guy Ritchie's RocknRolla in 2008.

He also earned an Emmy for playing US political figure Benjamin Franklin in 2008 mini-series John Adams and an Emmy nomination as John F Kennedy's father Joe in The Kennedys. He played President Lyndon B Johnson in 2014's Selma, and appeared in The Grand Budapest Hotel and Girl with a Pearl Earring.

His death on Saturday was confirmed in a statement shared by his agent on behalf of his family.

Wilkinson was, according to the Encyclopaedia of British Film, ""a major character star, with a remarkable gift - one among several - for conveying inner pain"".

Robert Carlyle, who starred alongside Wilkinson in The Full Monty, described him, as ""a huge performer, a real titan of an actor, one of the greats of not only his, but of any generation.""

In a tribute on X, formerly Twitter, British actor Phil Davis called him ""powerful and delicate and hugely intelligent - one of the very best"", while singer and actor Will Young described him as ""British acting royalty"".

US film maker Scott Derrickson said Wilkinson was ""an amazing talent"" and recalled a time when the actor gave him a surprise kiss on the lips on the set of The Exorcism of Emily Rose.

Alamy

Tom Wilkinson (right) played Gerald in The Full Monty

Born in Leeds before moving to Canada and then Cornwall in childhood, he found his calling at the age of 18 when he was asked to direct a play.

""For the first time in my life, I started doing something I knew how to do,"" he said.

""I realised it wasn't necessarily just these southern middle-class types that got to be actors; it could possibly be people like me. And once I knew, I never changed my mind.""

He trained at the Royal Academy of Dramatic Art (Rada) before following the well-worn path to theatre and television work. In 1986, he got his first major screen role in mini-series First Among Equals, based on Jeffrey Archer's best-selling novel.

Playing alongside him was Diana Hardcastle. The couple married in 1988, and also went on to play husband and wife in The Kennedys in 2011, and in 2014 action film Good People. The couple had two daughters, Alice and Molly.

Getty Images

Wilkinson and wife Diana pictured at the 2002 Oscars

When he portrayed Pecksniff in Martin Chuzzlewit for the BBC in 1994, Wilkinson said: ""I looked at it and I thought, I can't get it any better than that. It came out exactly as I meant it to come out. It won a couple of prizes and I thought, I can act, there's no question.""

Three years later, he was cast as a former factory foreman who joins fellow unemployed workmates in staging a strip show in The Full Monty.

""I was simultaneously offered the lead in a TV series and a possible part in a low-budget movie,"" he told The Guardian.

""I remember phoning a friend and he said, 'Take the TV, take the TV'. But I didn't follow his advice, and the TV turned out to be crap.""

The low-budget movie, meanwhile, turned out to be the highest-grossing British film up to that point, and took his career to a new level on both sides of the Atlantic.

Wilkinson received high critical acclaim for Todd Field's 2001 US domestic drama In the Bedroom, in which he played a bereaved father. He was nominated for an Oscar for best actor.

He hoped the film would do two things for him, he later said. ""One, [prove] I could play the lead role in a movie. Two, I could play an American lead role. And it did both of those things.""

The actor earned his second Academy Award nomination for his supporting role in Tony Gilroy's 2007 legal thriller Michael Clayton, starring George Clooney.

Getty Images

He appeared opposite George Clooney in 2007's Michael Clayton

Wilkinson's other credits included Batman Begins, The Patriot, Eternal Sunshine of the Spotless Mind, The Gathering Storm, Black Knight, Valkyrie, The Lone Ranger and Denial.

He also provided the voice of the fox in the TV adaptation of children's best-seller The Gruffalo.

His long term agent Lou Coulson has described him in interviews as ""one of the best"".

Off screen, Wilkinson was known for being down-to-earth and keeping a relatively low profile. He said in an interview: ""I like to go to Waitrose and not be recognised.""","Tom Wilkinson: The Full Monty actor dies at 75Watch: A look back at some of Tom Wilkinson's memorable performancesBritish actor Tom Wilkinson, known for films like The Full Monty, Shakespeare In Love and The Best Exotic Marigold Hotel, has died aged 75.
Wilkinson won a Bafta for 1997's The Full Monty, and reprised the role of Gerald when a Disney+ streaming series revisited the characters 26 years on.
George Clooney, who starred with Wilkinson in the 2007 legal thriller Michael Clayton, praised the actor as ""the epitome of elegance"".
Wilkinson was, according to the Encyclopaedia of British Film, ""a major character star, with a remarkable gift - one among several - for conveying inner pain"".
In a tribute on X, formerly Twitter, British actor Phil Davis called him ""powerful and delicate and hugely intelligent - one of the very best"", while singer and actor Will Young described him as ""British acting royalty""."
https://www.bbc.com/news/world-us-canada-67845251,Surfers take on giant waves as storm hits California,['Author not found'],"Surfers take on giant waves as storm hits California

By Max Matza BBC News

Surfers raced to California's famous Mavericks Beach surf spot to ride the huge waves

The world's best big wave surfers are descending on California to catch the biggest storm swells the US West Coast has seen in years.

Surfers from Brazil, France and Portugal have arrived at Mavericks, a famous wave south of San Francisco, to ride the giant walls of water.

Waves up to 70ft (21 meters) have been ridden, as even larger waves pass by.

Officials have warned onlookers to stay away from the shore after people were injured by huge rogue waves.

Chris Cuvelier, who runs the Maverick Surf Awards competition and can see the rolling swells from his kitchen, told BBC News on Friday that ""people have been getting on flights all over the world"" to surf the legendary spot this week.

Professional surfers, ""especially people that surf Mavericks, they're big wave surfers and many of them are travelling around the globe to go catch big waves"", he says.

Audrey Lambidakis/Maverick Surf Awards

Hunter Murison seen surfing Mavericks on Thursday

Famous pros like Kai Lenny, Andrew Cotton, and Lucas Chumbo have all appeared at Mavericks recently - some of them vying to win the prize money on offer from the Maverick Awards.

Filming the ride of their lives in this swell means they can enter into the digital competition for a chance at the as-yet unannounced 2024 prize pool.

JoJo Roper, a San Diego-based pro surfer, loaded up his car after Christmas once he saw the ""gigantic"" swell in the forecast.

It was the biggest since at least 2007, he says, telling BBC News ""it's been a long time since it's been that kind of a day"".

Mr Roper, 33, said he was one of the only Californian surfers out there on Thursday, riding the 60-70ft waves.

Watch: Dangerous high surf pummels California coast and attracts surfers

His friend flew from Hawaii to tow him into the waves on a jet ski.

""It's nice to have it in our territory, and take advantage of some waves close to home rather than travelling to Portugal or where all these other guys come from to chase their waves,"" he told BBC News.

""They're coming to chase our waves. It's pretty cool. It all comes full circle.""

Speaking on Friday, he called Thursday ""one of the best days in my lifetime for sure"".

Eight people were injured as a rogue wave swamped people and vehicles in the city of Ventura

On his third wave of the day, he fired into the barrel of a massive collapsing wall of water.

""It was an honour. And just to get barrelled is a whole other realm of victory,"" he says with a triumphant laugh.

""So I'm pretty happy about it.""

Getty Images

Onlookers climbed the cliffs near Half Moon Bay on Thursday to get a glimpse of Mavericks

Forecasters have issued warnings of more danger ahead after a rogue wave swept pedestrians off their feet and swamped a hotel in Ventura.

The National Weather Service (NWS) warned of ""extremely dangerous conditions.""

""Powerful waves and life-threatening rip currents pose an exceptional risk of ocean drowning and damage to coastal structures.""

The NWS said there is ""an increased risk for ocean drowning"" due to rip currents.

More swells are in the forecast for Mavericks, located near the city of Half Moon Bay.

But only the world's top professionals should consider getting into the ocean during this El Niño-driven weather event.","Surfers take on giant waves as storm hits CaliforniaBy Max Matza BBC NewsSurfers raced to California's famous Mavericks Beach surf spot to ride the huge wavesThe world's best big wave surfers are descending on California to catch the biggest storm swells the US West Coast has seen in years.
Surfers from Brazil, France and Portugal have arrived at Mavericks, a famous wave south of San Francisco, to ride the giant walls of water.
Officials have warned onlookers to stay away from the shore after people were injured by huge rogue waves.
Professional surfers, ""especially people that surf Mavericks, they're big wave surfers and many of them are travelling around the globe to go catch big waves"", he says.
Mr Roper, 33, said he was one of the only Californian surfers out there on Thursday, riding the 60-70ft waves."
https://www.bbc.com/news/world-asia-india-67851193,Vinesh Phogat: Top Indian wrestler returns medals over alleged sexual abuse,['Author not found'],"Vinesh Phogat: Top Indian wrestler returns medals over alleged sexual abuse

By Anbarasan Ethirajan & George Wright BBC News

EPA

Vinesh Phogat, seen here being detained by police in May, is a World Championship medallist

A top wrestler in India has returned two of her medals to highlight alleged sexual harassment of female athletes.

Vinesh Phogat, one of India's most decorated women wrestlers, left the prestigious awards on a roadside kerb after she was refused permission to meet Prime Minister Narendra Modi.

She and several wrestlers accuse former Wrestling Federation of India (WFI) chief Brij Bhushan Singh of sexually harassing women wrestlers for years.

Mr Singh denies the allegations.

Ms Phogat announced this week that that she was returning the Khel Ratna award, the country's highest sporting honour which she received in 2020, along with her Arjuna Award - both which are given by the government.

She had planned to deliver her awards to Mr Modi but was blocked by police.

Ms Phogat left her awards on a pavement in Delhi on Saturday. She said such honours had become meaningless at a time when wrestlers are struggling to get justice.

Protests by the wrestlers first began in January.

Ms Phogat - a two-time World Championship medallist - alleged that at least 10 women wrestlers had told her they had been sexually exploited by Mr Singh, who is an influential lawmaker and politician from the governing Bharatiya Janata Party (BJP).

ANI

Ex-WFI chief Brij Bhushan Singh has denied the allegations against him

A court is hearing sexual harassment and criminal intimidation charges against Mr Singh.

Ms Phogat said she has said that she had complained about him to the prime minister in 2021.

In May, the wrestlers alleged that they were abused and assaulted by police in Delhi where they had been protesting.

A close associate of Mr Singh was chosen as the new president of the federation earlier this month, triggering more angry protests by the wrestlers.

Another prominent female wrestler, Sakshi Malik, said she was quitting the sport in protest at the election of Mr Singh's loyalist.

Ms Phogat has won medals at the World Championships, Commonwealth Games and Asian Games.","Vinesh Phogat: Top Indian wrestler returns medals over alleged sexual abuseBy Anbarasan Ethirajan & George Wright BBC NewsEPAVinesh Phogat, seen here being detained by police in May, is a World Championship medallistA top wrestler in India has returned two of her medals to highlight alleged sexual harassment of female athletes.
Vinesh Phogat, one of India's most decorated women wrestlers, left the prestigious awards on a roadside kerb after she was refused permission to meet Prime Minister Narendra Modi.
She and several wrestlers accuse former Wrestling Federation of India (WFI) chief Brij Bhushan Singh of sexually harassing women wrestlers for years.
ANIEx-WFI chief Brij Bhushan Singh has denied the allegations against himA court is hearing sexual harassment and criminal intimidation charges against Mr Singh.
In May, the wrestlers alleged that they were abused and assaulted by police in Delhi where they had been protesting."
https://www.bbc.com/news/world-europe-67851431,"Ukraine war: Russia launches fresh drone assault on Kyiv and Kharkiv, officials say",['Author not found'],"Ukraine war: Russia launches fresh drone assault on Kyiv and Kharkiv, officials say

By George Wright BBC News

EPA

Russia has been striking Kharkiv in recent days

Ukraine is again under attack by Russian drones, officials say, after two days of major aerial assaults by both sides.

There are reports of explosions in Kyiv and Kharkiv, where the mayor said residential buildings were on fire.

Moscow has been retaliating against Ukrainian strikes on the Russian border city of Belgorod on Saturday, which killed at least 20 people.

That came after Russia carried out strikes across Ukraine on Friday.

Those strikes, which killed 39 people, were described by Kyiv as Russia's biggest missile bombardment of the war so far.

The latest attacks happened as Ukraine entered its final day of 2023.

Ukraine's air defence systems in the region surrounding the capital Kyiv were engaged late on Saturday to repel a Russian drone attack, the military administration of the region said on Telegram.

Drone attacks have been reported in the north-eastern city of Kharkiv, mayor Ihor Terekhov said on Telegram.

""These are not military facilities, but cafes, residential buildings and offices,"" he said.

""On the eve of the New Year, the Russians want to intimidate our city, but we are not scared - we are unbreakable and invincible.""

The extent of the damage is not clear and no casualties have been reported yet.

Earlier on Saturday, Russian strikes injured 19 in Kharkiv, the local government reported.

The latest attacks come after a deadly couple of days in Ukraine and Russia.

Russia's massive bombardment of Ukraine on Friday killed 39 people and injured nearly 160, according to President Volodymyr Zelensky. Several cities were hit, including the capital, Kyiv.

The mayor of Kyiv, Vitali Klitchsko, said at least 16 people were killed in the city - making Friday the deadliest day so far for civilians in the capital.

This was followed by Ukrainian attacks on Russia.

Moscow accused Ukraine of deadly air strikes on the south-west of the country - with 20 people killed and more than 100 injured in Belgorod, near the border.

The regional governor said three children were among the dead in what was one of the deadliest attacks on Russia since it invaded Ukraine.

Speaking to the BBC, the Ukrainian security source said more than 70 drones had been launched against Russian targets, as a ""response to Russia's terrorist attacks on Ukrainian cities and civilians"".

Addressing the situation in Belgorod, they blamed the ""incompetent work of Russian air defence"" for civilian casualties - saying this was what caused falling fragments.

Moscow has repeatedly accused Ukraine of being behind drone strikes in recent months. Kyiv rarely admits to such attacks across the border, although it has carried out strikes like this before.","Ukraine war: Russia launches fresh drone assault on Kyiv and Kharkiv, officials sayBy George Wright BBC NewsEPARussia has been striking Kharkiv in recent daysUkraine is again under attack by Russian drones, officials say, after two days of major aerial assaults by both sides.
There are reports of explosions in Kyiv and Kharkiv, where the mayor said residential buildings were on fire.
Moscow has been retaliating against Ukrainian strikes on the Russian border city of Belgorod on Saturday, which killed at least 20 people.
Those strikes, which killed 39 people, were described by Kyiv as Russia's biggest missile bombardment of the war so far.
Earlier on Saturday, Russian strikes injured 19 in Kharkiv, the local government reported."
https://www.bbc.com/sport/tennis/67847517,Dominic Thiem's Brisbane International victory interrupted by venomous snake on court,['Author not found'],"Last updated on .From the section Tennis

Former world number three Dominic Thiem was a set down when the snake interrupted play in Brisbane

A highly venomous snake interrupted play during Dominic Thiem's victory against James McCabe at the Brisbane International qualifying event.

Former US Open champion Thiem was a set down to Australian McCabe when the snake was spotted near the courtside electrical wires.

A 40-minute break in play followed while the reptile was safely removed by a professional snake catcher.

""I really love animals, especially exotic ones,"" Thiem said afterwards.

""But they said it was a really poisonous snake and it was close to the ball kids, so it was a really dangerous situation.

""It's something that has never happened to me and is something I'll definitely never forget.""

The animal was identified as a highly venomous eastern brown snake and was approximately 50cm in length.

Following the delay, Thiem recovered to win 2-6 7-6 (7-4) 6-4 and advance to the second and final round of qualifying for the Brisbane International.

The Austrian, who has slipped to 98th in the world rankings after injury struggles, is also expected to play in the qualifying draw for the Australian Open, which starts on 14 January.

Former world number one Rafael Nadal will mark his return in Brisbane on Sunday in a doubles match alongside Marc Lopez.

The 22-time Grand Slam champion has been recovering from a hip injury that required surgery in June.

Naomi Osaka is also returning to tennis in the women's draw following her maternity leave and will face Tamara Korpatsch on Monday.","Last updated on .From the section TennisFormer world number three Dominic Thiem was a set down when the snake interrupted play in BrisbaneA highly venomous snake interrupted play during Dominic Thiem's victory against James McCabe at the Brisbane International qualifying event.
Former US Open champion Thiem was a set down to Australian McCabe when the snake was spotted near the courtside electrical wires.
""But they said it was a really poisonous snake and it was close to the ball kids, so it was a really dangerous situation.
The animal was identified as a highly venomous eastern brown snake and was approximately 50cm in length.
Following the delay, Thiem recovered to win 2-6 7-6 (7-4) 6-4 and advance to the second and final round of qualifying for the Brisbane International."
