URL,Title,Authors,Text,TF_IDF_Summary
https://www.bbc.com/news/world-africa-67992038,Kenya cult leader Paul Mackenzie faces terror charges over mass deaths,['Author not found'],"Kenya cult leader Paul Mackenzie faces terror charges over mass deaths

Getty Images

Self-proclaimed pastor Paul Mackenzie has been in custody since April

A suspected Kenyan cult leader is to be charged with murder and terrorism over the deaths of more than 400 people found in mass graves, prosecutors say.

Paul Mackenzie was arrested in April after the discovery of hundreds of bodies, some of whom were said to have starved themselves to death.

Kenyan prosecutors say that he and 94 others will be charged in court in Malindi on Wednesday.

The self-proclaimed pastor has denied responsibility for the deaths.

The bodies of 429 people, including children, have been dug up from grave sites in Shakahola, a remote forest about two hours' drive west of Malindi. Most showed signs of starvation, but some - children among them - may have been assaulted.

Mr Mackenzie is alleged to have encouraged members of his Good News International Church to move there and prepare for the end of the world.

One witness told the BBC that people were given instructions in January last year to begin fasting so that they could ""get to heaven"".

But Mr Mackenzie has said the deaths could not be down to him as he closed his church in 2019.

Getty Images

Several mass grave sites were found in Shakahola forest

Investigators had asked for his time in custody to be extended several times as they continued their investigation.

They said their inquiries had now gathered enough evidence to charge him and the others with offences including murder, assault and ""facilitating the commission of a terrorist act"".

They are also facing a charge of ""subjecting a child to torture"", according to a statement from the director of public prosecutions.

The charges were listed a week after the court gave the prosecutors a fortnight's deadline to make them public or face the possibility that the suspects could be released.

Out of the 95 suspects, 64 had been found in Shakahola and were initially treated as victims and moved to a rescue centre.

However, investigators later found that many of them had children who had died in the forest.

Some of them had given false names and identities and failed to account for their children.","Kenya cult leader Paul Mackenzie faces terror charges over mass deathsGetty ImagesSelf-proclaimed pastor Paul Mackenzie has been in custody since AprilA suspected Kenyan cult leader is to be charged with murder and terrorism over the deaths of more than 400 people found in mass graves, prosecutors say.
Paul Mackenzie was arrested in April after the discovery of hundreds of bodies, some of whom were said to have starved themselves to death.
Kenyan prosecutors say that he and 94 others will be charged in court in Malindi on Wednesday.
But Mr Mackenzie has said the deaths could not be down to him as he closed his church in 2019.
Getty ImagesSeveral mass grave sites were found in Shakahola forestInvestigators had asked for his time in custody to be extended several times as they continued their investigation."
https://www.bbc.com/news/world-asia-67990948,North Korea's Kim Jong Un abandons unification goal with South,['Author not found'],"North Korea's Kim Jong Un abandons unification goal with South

By Oliver Slow BBC News

Reuters

Kim Jong Un met Russian leader Vladimir Putin in September

North Korean leader Kim Jong Un has said unification with the South is no longer possible, and that the constitution should be changed to designate it the ""principal enemy"".

Mr Kim also said three organisations dealing with reunification would shut down, state media KCNA reported.

South Korea's president said it would respond ""multiple times stronger"" to any provocation from the North.

The two Koreas have been divided since the Korean War ended in 1953.

They did not sign a peace treaty and therefore have remained technically still at war ever since.

In a speech delivered at the Supreme People's Assembly - North Korea's rubber-stamp parliament - Mr Kim said that the constitution should be amended to educate North Koreans that South Korea is a ""primary foe and invariable principal enemy"".

He also said that if a war breaks out on the Korean peninsula, the country's constitution should reflect the issue of ""occupying"", ""recapturing"" and ""incorporating"" the South into its territory.

Mr Kim - who replaced his father, Kim Jong-il, as North Korean leader in 2011 - said the North ""did not want war, but we also have no intention of avoiding it"", according to KCNA.

He said he was taking a ""new stand"" on north-south relations, which included dismantling all organisations tasked with reunification.

Speaking to his cabinet on Tuesday, South Korean President Yoon Suk Yeol said that if the North carried out a provocation, the South ""will retaliate multiple times stronger"", pointing to the South Korean military's ""overwhelming response capabilities"".

Dr John Nilsson-Wright, who heads the Japan and Koreas Programme at Cambridge University's Centre for Geopolitics, described Mr Kim's remarks as ""unprecedented"", and said it was ""highly unusual"" for a North Korean leader to depart from the policy of unification.

""It's not unusual for relations between the North and South to cool, but this has taken the relationship in a different direction,"" he told the BBC.

He added that Mr Kim's anti-Western stance can be traced back to the 2019 summit with then-US President Donald Trump in Vietnam, which ended without an agreement.

""This has been an acute disappointment and loss of face for Kim,"" Dr Nilsson-Wright said.

Heightened tensions

Mr Kim's comments came as relations significantly weakened on the Korean Peninsula in recent months.

In November, North Korea fully suspended a five-year military deal with the South aimed at lowering military tensions. It promised to withdraw all measures ""taken to prevent military conflict in all spheres including ground, sea and air"", and said it would deploy more forces to the border region.

The South had partly suspended the agreement days earlier after Mr Kim claimed to have successfully launched a spy satellite into space.

The rhetoric - and provocative actions - from the North have only escalated since then.

At year-end policy meetings, Mr Kim said he needed to ""newly formulate"" the North's stance towards inter-Korean relations and reunification policy, adding that the stated goal was to ""make a decisive policy change"" related to ""the enemy"".

He also threatened a nuclear attack on the South, and called for a build-up of his country's military arsenal.

The North has also launched missiles in recent weeks, as well as live-fire exercises close to South Korean territory.

In a report published last week for 38 North, a US-based organisation with a focus on North Korea, former State Department official Robert Carlin and nuclear scientist Siegfried S Hecker said they saw the situation on the Korean Peninsula as ""more dangerous than it has ever been"" since the start of the Korean War in 1950.

""That may sound overly dramatic, but we believe that, like his grandfather in 1950, Kim Jong Un has made a strategic decision to go to war,"" it said.

""We do not know when or how Kim plans to pull the trigger, but the danger is already far beyond the routine warnings in Washington, Seoul and Tokyo about Pyongyang's 'provocations'.""

It added that it did not see the ""war preparation themes"" in North Korean media as ""typical bluster"".

Dr Nilsson-Wright agreed and said the ""risk of escalation should be taken seriously"".

Meanwhile North Korea's Foreign Minister Choe Son Hui is in Russia where she is expected to meet President Vladimir Putin.","North Korea's Kim Jong Un abandons unification goal with SouthBy Oliver Slow BBC NewsReutersKim Jong Un met Russian leader Vladimir Putin in SeptemberNorth Korean leader Kim Jong Un has said unification with the South is no longer possible, and that the constitution should be changed to designate it the ""principal enemy"".
Mr Kim also said three organisations dealing with reunification would shut down, state media KCNA reported.
South Korea's president said it would respond ""multiple times stronger"" to any provocation from the North.
Speaking to his cabinet on Tuesday, South Korean President Yoon Suk Yeol said that if the North carried out a provocation, the South ""will retaliate multiple times stronger"", pointing to the South Korean military's ""overwhelming response capabilities"".
Meanwhile North Korea's Foreign Minister Choe Son Hui is in Russia where she is expected to meet President Vladimir Putin."
https://www.bbc.com/news/world-asia-india-67989930,Sachin Tendulkar: Indian cricket legend flags 'disturbing' deepfake video,['Author not found'],"Sachin Tendulkar: Indian cricket legend flags 'disturbing' deepfake video

By Nikhila Henry BBC News, Delhi

Getty Images

Tendulkar is the latest Indian celebrity to be targeted by deepfakes

Indian cricket legend Sachin Tendulkar has criticised a deepfake video in which he seems to be promoting an online gaming app.

The video shows him praising the app as a quick way to make money.

""These videos are fake. It is disturbing to see rampant misuse of technology,"" he posted on X (formerly Twitter).

Tendulkar is the latest Indian celebrity to speak up against deepfake videos.

A few months ago, actress Rashmika Mandanna urged people not to share such material after a deepfake video of hers went viral. The video, which had Mandanna's face morphed onto an Instagram video posted by a British-Indian woman, sparked a conversation in India about the misuse of technology.

The actress, who called the incident ""extremely scary"", had asked girls to speak up if this happened to them.

Other Indian actresses such as Alia Bhatt, Kajol and Katrina Kaif have also been targeted by deepfake videos.

In Tendulkar's case, the video also showed him saying that his daughter used the gaming app regularly.

""Social media platforms need to be alert and responsive to complaints. Swift action from their end is crucial to stopping the spread of misinformation and deepfakes,"" the iconic batsman wrote.

Tendulkar, one of India's most-loved cricketers who retired in 2013, endorses several top brands.

Responding to Tendulkar's post, Rajeev Chandrasekhar, India's junior minister for information technology (IT), said that ""deepfakes and misinformation powered by AI"" threatened the safety of internet users.

He added that India will soon notify strict rules to ensure that social media platforms took down deepfake videos immediately.

Under India's IT rules, social media platforms have to ensure that ""no misinformation is posted by any user"". Platforms that do not comply could be taken to court under Indian law.

Mr Chandrasekhar and federal IT minister Ashwini Vaishnaw have spoken up against deepfakes earlier.

In November, Mr Vaishnaw had chaired a meeting with social media platforms and artificial intelligence companies where he said the government would soon come up with a ""clear, actionable plan"" to tackle deepfakes.

BBC News India is now on YouTube. Click here to subscribe and watch our documentaries, explainers and features.","Sachin Tendulkar: Indian cricket legend flags 'disturbing' deepfake videoBy Nikhila Henry BBC News, DelhiGetty ImagesTendulkar is the latest Indian celebrity to be targeted by deepfakesIndian cricket legend Sachin Tendulkar has criticised a deepfake video in which he seems to be promoting an online gaming app.
A few months ago, actress Rashmika Mandanna urged people not to share such material after a deepfake video of hers went viral.
The video, which had Mandanna's face morphed onto an Instagram video posted by a British-Indian woman, sparked a conversation in India about the misuse of technology.
""Social media platforms need to be alert and responsive to complaints.
He added that India will soon notify strict rules to ensure that social media platforms took down deepfake videos immediately."
https://www.bbc.com/news/world-europe-67988451,Two British brothers 'should be banned from Switzerland' for museum heist,['Author not found'],"Two British brothers 'should be banned from Switzerland' for museum heist

By Thomas Mackintosh BBC News, in Geneva

Patrick Tondeux

A court artist's sketch of the two brothers appearing at the Palais de Justice in Geneva

Prosecutors have called for two British brothers to be banned from Switzerland for five years as punishment for their role in raiding a museum of iconic Chinese Ming Dynasty artefacts.

At a court in Geneva on Monday, Stewart and Louis Ahearne confessed to being part of a gang which burgled the Museum of Far Eastern Art in June 2019.

On top of the ban, prosecutor Marco Rossier said the court should jail the brothers for four years.

They will be sentenced on Tuesday.

Mr Rossier told the court the brothers, who are from south-east London - and a third man named in court by lawyers as Daniel Kelly - were all ""equally involved"" in the burglary.

He said Louis Ahearne carried out reconnaissance of the museum, while his older brother Stewart hired a Renault Captur car out in his name - which he then drove to and from the scene of the crime.

""Louis Ahearne booked the hotel room, the ski masks and clothing used in the burglary,"" Mr Rossier said.

""Everything was prepared and organised. Everything was very quick.""

Two bowls and a vase from the 14th Century were taken in the raid, Mr Rossier explained, adding one bowl was taken to a Hong Kong auction house by the three men. Stewart Ahearne left his passport details as they sold the item, the prosecutor added.

A second item, a vase, was recovered in central London as part of an undercover sting operation with Metropolitan Police officers posing as art buyers a year after the heist.

The third plundered artefact, a wine cup, has never been recovered.

Met Police

A Doucai-style wine cup stolen from the museum remains missing

Around 3.5m Swiss francs (£3.2m) worth of damage was caused to the Museum of Far Eastern Art which is based in a listed townhouse in Geneva's old town.

On Monday, Louis Ahearne said he carried out the burglary in order to ""clear a debt"" and Stewart Ahearne said he took ""full responsibility"" explaining he wanted to ""protect"" his younger brother.

Mr Rossier said the prosecution doubted the brothers' version of events as the third person was not in the court and is currently the subject of extradition proceedings to Japan.

The court also heard from Loris Bertoliatti, representing the Museum of Far Eastern Art, who said damage caused by a power saw, sledgehammer and crowbar cost the institution millions.

""They are a professional gang,"" he said. ""They were determined to sell the items. The victim is the museum. Lots of people were shocked by what happened.""

Stewart Ahearne's partner Nicola Barry was called as a witness on Monday and described the father-of-five as a ""kind, loving and nice person"" - adding his employer has committed to giving him a job when he is freed.

The brothers' mother, Suzanne Ahearne, said Louis Ahearne is a ""compassionate and empathetic"" person who had an ""unhappy childhood"".

She told the court since his extradition from the UK, he has been writing to his nine-year-old son from prison in Switzerland trying to ""give the guidance he never got"" from his father.

The Ahearnes' defence barristers will also provide mitigation before the president of the court Patrick Monney delivers his judgement.","Two British brothers 'should be banned from Switzerland' for museum heistBy Thomas Mackintosh BBC News, in GenevaPatrick TondeuxA court artist's sketch of the two brothers appearing at the Palais de Justice in GenevaProsecutors have called for two British brothers to be banned from Switzerland for five years as punishment for their role in raiding a museum of iconic Chinese Ming Dynasty artefacts.
On top of the ban, prosecutor Marco Rossier said the court should jail the brothers for four years.
""Louis Ahearne booked the hotel room, the ski masks and clothing used in the burglary,"" Mr Rossier said.
Stewart Ahearne left his passport details as they sold the item, the prosecutor added.
The brothers' mother, Suzanne Ahearne, said Louis Ahearne is a ""compassionate and empathetic"" person who had an ""unhappy childhood""."
https://www.bbc.com/news/science-environment-67986443,"A23a: Spectacular arches, caves as monster iceberg decays",['Author not found'],"A23a: Spectacular arches, caves as monster iceberg decays

By Jonathan Amos Science correspondent

EYOS EXPEDITIONS/Richard Sidey

Wave action is cutting caves and arches in the walls of A23a

Erosion is sculpting dramatic features into the world's biggest iceberg in what's likely to be the final months of its existence.

A ship run by the Eyos expeditions company arrived at the frozen behemoth, A23a, on Sunday to find huge caves and arches cut into its frozen walls.

The berg is being ground down by the warmer air and surface waters it's encountering as it drifts slowly away from the White Continent.

Ultimately, it will melt and disappear.

""We saw waves, a good 3m or 4m high, smashing into the berg,"" said expedition leader Ian Strachan.

""These were creating cascades of ice - a constant state of erosion,"" he told BBC News.

Copernicus Data/Esa/Sentinel-3

Pictured from space: A23a is about 200km west of the South Orkney Islands, partially covered here by cloud

A23a broke away from the Antarctic coastline way back in 1986, but it's only recently begun a big migration.

For more than 30 years, it was stuck rigidly in the bottom-muds of the Weddell Sea, like a static ""ice island"" measuring some 4,000 sq km (1,500 sq miles) in area. That's more than twice the size of Greater London.

The colossus is presently drifting in the Antarctic Circumpolar Current, the great sweep of water that circles the continent in a clockwise direction.

This current, together with the prevailing westerlies, is pushing A23a in the general direction of the South Orkney Islands, which are about 600km (370 miles) northeast of the tip of the Antarctic Peninsula.

The berg has entered what scientists refer to as ""iceberg alley"", a track that passes South Georgia

It is firmly in the track of what scientists refer to as ""iceberg alley"" - the major route for the export of ice from the continent.

The interplay of winds, ocean fronts and eddies will determine its precise course over the coming weeks, but many of these giant flat-topped, or tabular, bergs end up passing by the British Overseas Territory of South Georgia.

Their destiny is to fragment and wither to nothing. Their legacy is the ocean life they seed by dropping entrained mineral nutrients. From plankton up to great whales - all benefit from the melting bergs' fertilisation effect.

EYOS EXPEDITIONS/Richard Sidey

A submerged terrace develops as the walls crumble. Buoyancy will force this terrace upwards

On Sunday, the Eyos team got close enough to A23a to put up a drone. The berg's 30m-high cliffs were topped by a dense mist. Icebergs on this scale create their own weather.

""It was dramatic and beautiful to photograph,"" said Eyos videographer Richard Sidey.

""It's mind-bogglingly big. I actually don't think we can fathom just how big it is; we can only know how big it is from science. It's certainly too big to photograph. It stretches as far as you can see in both directions.""

Satellite observations can monitor its area coverage and gauge its thickness, which is over 300m (980ft) in places. In terms of mass, it's not far off a trillion tonnes, although this will be decreasing day by day.

EYOS EXPEDITIONS/Ian Strachan

A dense mist hangs over A23a: It's so big it makes its own weather

The big question is: how long can A23a survive as it moves away from the colder climes of the Antarctic?

Milder air temperatures will create surface melt ponds that drain through the berg, helping to open up fractures. And those spectacular surface catacombs and arches will collapse to leave extensive areas of submerged ice that will then rise up under their own buoyancy to gnaw away at the berg's edges.

But another large block of ice ahead of A23a on the highway may be instructive in understanding its potential longevity.

Copernicus Data/Esa/Sentinel-3

D28 is about 1,000 sq km (385 sq miles) in size and moving north of South Georgia

Iceberg D28, also known by its popular name ""Molar Berg"", is now moving up into the South Atlantic, some 200km (125 miles) north of South Georgia. Even though it's lost about a third of its area since calving from Antarctica's Amery Ice Shelf in 2019, D28 has managed to maintain its basic, compact shape.","A23a: Spectacular arches, caves as monster iceberg decaysBy Jonathan Amos Science correspondentEYOS EXPEDITIONS/Richard SideyWave action is cutting caves and arches in the walls of A23aErosion is sculpting dramatic features into the world's biggest iceberg in what's likely to be the final months of its existence.
A ship run by the Eyos expeditions company arrived at the frozen behemoth, A23a, on Sunday to find huge caves and arches cut into its frozen walls.
For more than 30 years, it was stuck rigidly in the bottom-muds of the Weddell Sea, like a static ""ice island"" measuring some 4,000 sq km (1,500 sq miles) in area.
Buoyancy will force this terrace upwardsOn Sunday, the Eyos team got close enough to A23a to put up a drone.
But another large block of ice ahead of A23a on the highway may be instructive in understanding its potential longevity."
https://www.bbc.com/news/world_radio_and_tv,BBC World News: 24 hours news TV channel,['Author not found'],"'This building is just a snapshot of the devastation' Video, 00:00:55'This building is just a snapshot of the devastation'","'This building is just a snapshot of the devastation' Video, 00:00:55'This building is just a snapshot of the devastation'"
https://www.bbc.com/sounds/play/live:bbc_world_service,World Service - Listen Live - BBC Sounds,['Author not found'],Fujitsu says it has a 'moral obligation' to UK Post Office victims Fujitsu says it has a 'moral obligation' to UK Post Office victims,Fujitsu says it has a 'moral obligation' to UK Post Office victims Fujitsu says it has a 'moral obligation' to UK Post Office victims
