URL,Title,Authors,Text,TF_IDF_Summary
https://www.bbc.com/news/live/world-us-canada-67973518,Iowa caucus 2024: Race heads to New Hampshire after Donald Trump wins big victory,['Author not found'],"Republicans in Iowa were the first to cast their votes in support of a presidential candidate to take on Democratic President Joe Biden ahead of the 2024 election.

Most states run primary contests to nominate a presidential candidate but caucuses have a different process.

Caucuses require party members to attend a location, in person, at a specific time. At schools, community centres and churches across the state, representatives for the candidates make speeches before those present cast their votes by writing down a name.

Most states have moved away from caucuses in favour of primaries, but the Iowa Republican Party - along with those in Nevada, Idaho, Missouri, North Dakota, Hawaii, Wyoming and Kentucky - have all stuck to the system.

The actual prize Republicans are fighting for in Iowa is minimal. Candidates will split a measly 40 delegates, a little more than 1% of the total number in play at the Republican National Convention in July.

But a win for any candidate in Iowa can help energise their campaign at a crucial early stage and potentially propel them to victory in the primaries.

It also marks the first time the country can see how a candidate fares in an actual election, and can generate significant attention in the media.

Read more: What you need to know about the Republican vote","Republicans in Iowa were the first to cast their votes in support of a presidential candidate to take on Democratic President Joe Biden ahead of the 2024 election.
Most states run primary contests to nominate a presidential candidate but caucuses have a different process.
Caucuses require party members to attend a location, in person, at a specific time.
Most states have moved away from caucuses in favour of primaries, but the Iowa Republican Party - along with those in Nevada, Idaho, Missouri, North Dakota, Hawaii, Wyoming and Kentucky - have all stuck to the system.
But a win for any candidate in Iowa can help energise their campaign at a crucial early stage and potentially propel them to victory in the primaries."
https://www.bbc.com/news/world-us-canada-67989443,Iowa caucuses: What Trump's dominant win means for his rivals,['Author not found'],"Iowa caucuses: What Trump's dominant win means for his rivals

By Anthony Zurcher North America correspondent in Des Moines, Iowa

Watch: The Iowa caucuses... a dramatic night in 82 seconds

It was perhaps the least surprising victory in the history of the Iowa caucuses.

Donald Trump won by a landslide in the first contest in the Republican race for a presidential nominee, the margin in the end as comfortable as the polls had predicted for months.

But dominating the vote count was just one reason why the former president was celebrating on Monday night after his supporters braved extreme cold weather to deliver him the win.

Neither of Mr Trump's main rivals, Nikki Haley nor Ron DeSantis, emerged as a lead challenger - so the not-Trump vote remains divided. Meanwhile, his most ideologically similar rival, Vivek Ramaswamy, announced he was dropping out - and will endorse Mr Trump in New Hampshire on Tuesday.

Here is a closer look at why the results in Iowa were so significant in the race for the White House.

This is still Donald Trump's party

Mr Trump's victory in Iowa was historically massive. He won the most votes in all but one of Iowa's 99 counties (he lost the other by a single vote).

No one had prevailed in an Iowa contest by more than 12 points before - Mr Trump's margin will approach 30% and he could end up winning an outright majority of the Republicans who turned out.

With almost all the votes counted, Mr Trump had won 51%, with Mr DeSantis on 21% and Ms Haley on 19%.

A survey of Iowans entering caucus sites on Monday night helps explain exactly why his bid for an electoral encore has been successful so far.

About half of Republican caucus-goers consider themselves part of Trump's ""Make America Great Again"" movement, according to CBS News, the BBC's US partner.

Mr Trump's victory was a broad one as well. He won the young and old, men and women. He also won over the evangelical and hard-right conservative voters he had difficulty winning in 2016.

Typically, defeated presidential candidates fade from memory, never able to shake the taint of the loss. Mr Trump, however, has managed to convince Republicans - here in Iowa and nationally - that he didn't lose.

A large majority of caucus-goers in Iowa told CBS they believed Mr Trump was the actual winner of the 2020 presidential election - a number that increased to 90% among Trump supporters.

Trump victory is a remarkable turnaround

Mr Trump's dominant position within the Republican Party has been irrefutable - but his win here, in the larger context of modern American politics, is extraordinary.

Three years ago, he ended his first presidential term under a cloud of controversy, his campaign to challenge his loss to Democrat Joe Biden culminating in the January 6 Capitol riot. He faces two criminal trials stemming from those actions.

Now, as the winner of the Iowa caucuses, he has taken the first significant step toward becoming the Republican Party's nominee in November's presidential election.

Trump still has work to do to become the Republican standard-bearer. He will face a more formidable challenge from Ms Haley in New Hampshire next week, where polls show his once dominating lead has been whittled to near single digits.

But he is still the overwhelming favourite in the race, endorsed in his first test by actual Republican voters.

No clear rival emerged from Iowa

Entering Monday's Iowa caucuses, most of the electoral intrigue involved which candidate would take second place behind Mr Trump. In the end, it was Mr DeSantis who walked away with the runner-up prize.

It's not much of an achievement, however, given the narrowness with which the Florida governor finished ahead of Ms Haley, after investing so much time and resources in Iowa.

The result, and Mr DeSantis's pledge to press on with his campaign, won't provide the kind of clear result that would set up a one-on-one face-off with Trump in the days ahead.

Getty Images

Trump supporters were jubilant

In fact, the result may make Trump's victory all the more potent, as his divide-and-conquer strategy is still fully in place as the Republican primary process kicks into gear.

The one candidate who did drop out, Mr Ramaswamy, will further clear the field for the former president, as public opinion surveys show that his supporters have Mr Trump as their second choice. While he only garnered about 8% in Iowa, every bit of backing counts, and Mr Ramaswamy's endorsement will offer Mr Trump yet another headline to boost him into New Hampshire.

The Iowa result will also let the former president further focus his fire on President Biden, something he eagerly did during his victory speech on Monday night. For their part, the Democrats seem to be welcoming the showdown and the opportunity to exploit what they see as Mr Trump's vulnerabilities.

A series of dominating wins, starting in Iowa, will give the former president momentum, however - and the air of a winner. By the time the autumn general election rolls around, Mr Trump may prove to be a more formidable adversary than they expected - or hoped.","Iowa caucuses: What Trump's dominant win means for his rivalsBy Anthony Zurcher North America correspondent in Des Moines, IowaWatch: The Iowa caucuses... a dramatic night in 82 secondsIt was perhaps the least surprising victory in the history of the Iowa caucuses.
Neither of Mr Trump's main rivals, Nikki Haley nor Ron DeSantis, emerged as a lead challenger - so the not-Trump vote remains divided.
This is still Donald Trump's partyMr Trump's victory in Iowa was historically massive.
Mr Trump's victory was a broad one as well.
For their part, the Democrats seem to be welcoming the showdown and the opportunity to exploit what they see as Mr Trump's vulnerabilities."
https://www.bbc.com/news/world-us-canada-67989135,Iowa caucuses: DeSantis edges out Haley as both trail Trump in Iowa,['Author not found'],"Iowa caucuses: DeSantis edges out Haley as both trail Trump in Iowa

By Mike Wendling, Bernd Debusmann Jr & Holly Honderich BBC News, Iowa

Watch: The Iowa caucuses... a dramatic night in 82 seconds

Florida Governor Ron DeSantis has snatched second place in Iowa's caucuses, edging former UN ambassador Nikki Haley into third in a Republican contest dominated by Donald Trump.

Mr DeSantis had campaigned relentlessly in the state but he finished a long way behind the former president.

With nearly all the votes counted, Mr Trump has 51% of the vote, with Mr DeSantis on 21% and Ms Haley on 19%.

Iowa was the first state for Republican voters to make their White House pick.

Their election is called a caucus because people have to show up in person at a certain time in order to cast their vote.

The party's eventual nominee will challenge the Democratic choice, almost certainly President Joe Biden, in November's election.

In a victory party at the state capital Des Moines, Mr Trump hailed a special night and urged Americans to come together to ""straighten out the world"".

Registered Republicans braved sub-zero temperatures to gather on Monday evening across Iowa to cast ballots at churches, schools, gyms and community centres.

Mr Trump had been the overwhelming favourite to win Iowa and Glenn Jacobs, a former WWE wrestler who is campaigning for Mr Trump, had predicted the big win.

Speaking to the BBC an hour before voting began in Des Moines, he said the country was heading in the wrong direction, citing the border crisis and US intervention in the Middle East.

At the same time, across the city, Mr Trump's son Eric told the BBC he hoped his father would wrap up the nomination by Super Tuesday on 3 March, when more than a dozen states will vote.

""We've [the country] become a laughing stock and it's got to stop,"" he said. ""Hopefully it stops in Iowa.""

At a high school in Davenport, in the eastern part of the state, Trump supporter Brian Romer gave an impassioned speech to his fellow Republicans in favour of the former president.

Getty Images

Ron DeSantis said he was happy with second

""The things that happen in this country are things that happen in communist countries,"" he said, referring to Mr Trump's criminal indictments. ""We don't live in a free country anymore.""

But both Mr DeSantis and Ms Haley, the former governor of South Carolina and US ambassador to the UN under President Trump, claimed on Monday night that the political wind was in their sails.

""They threw everything but the kitchen sink at us,"" Mr DeSantis said. ""The media was against us. They were writing our obituary months ago.

""In spite of all of that… we've got our ticket punched out of Iowa.""

Kyle Brock rallied support for Mr DeSantis at a primary school in the Des Moines suburbs, arguing it was time for Republicans to move on from Mr Trump.

""I like his [the Florida governor's] integrity, and the way he presents himself and - really - what he got done in Florida,"" he said.

Mr DeSantis spent most of his time and resources in Iowa, campaigning in all 99 counties and courting the rural state's influential bloc of evangelical voters.

But the conservative Florida governor could face tougher terrain in the more moderate state of New Hampshire, which holds its primary next week.

Ms Haley, who has an outside chance of beating Mr Trump in the state, claimed she had the momentum.

But her third-place finish seemed a disappointment for a candidate who was said to be surging ahead of the caucuses.

Getty Images

Nikki Haley at caucus party

Hallie Still-Caris, at a caucus at a Des Moines high school, said Ms Haley had the best chance to win in November.

""I look at the other Republican candidates and President Biden,"" she said, ""and I think she's electable. That's what we need - less drama and less chaos.""

Biotech entrepreneur Vivek Ramaswamy suspended his presidential campaign after a distant fourth-place finish. He endorsed Mr Trump.

In a post on X, Mr Biden noted that he seemed to be heading for a rematch with Mr Trump.

""But here's the thing: this election was always going to be you and me vs extreme Maga Republicans,"" the Democratic president wrote. ""It was true yesterday and it'll be true tomorrow.""

More on the US election

According to the entrance poll data, Mr Trump won strong support from white evangelicals and very conservative voters.

He also won more broadly among men, women, older voters and younger voters, improving on his 2016 performance with all of these groups.

Mr Trump has consolidated his lead among Republicans in national opinion polls even as he faces four separate criminal trials and two civil trials.","Iowa caucuses: DeSantis edges out Haley as both trail Trump in IowaBy Mike Wendling, Bernd Debusmann Jr & Holly Honderich BBC News, IowaWatch: The Iowa caucuses... a dramatic night in 82 secondsFlorida Governor Ron DeSantis has snatched second place in Iowa's caucuses, edging former UN ambassador Nikki Haley into third in a Republican contest dominated by Donald Trump.
With nearly all the votes counted, Mr Trump has 51% of the vote, with Mr DeSantis on 21% and Ms Haley on 19%.
Mr Trump had been the overwhelming favourite to win Iowa and Glenn Jacobs, a former WWE wrestler who is campaigning for Mr Trump, had predicted the big win.
In a post on X, Mr Biden noted that he seemed to be heading for a rematch with Mr Trump.
More on the US electionAccording to the entrance poll data, Mr Trump won strong support from white evangelicals and very conservative voters."
https://www.bbc.com/news/world-us-canada-67990383,Iowa caucuses 2024: Vivek Ramaswamy suspends campaign and endorses Trump,['Author not found'],"Iowa caucuses 2024: Vivek Ramaswamy suspends campaign and endorses Trump

By Max Matza BBC News

Reuters

Entrepreneur Vivek Ramaswamy has dropped out of the presidential race after a disappointing finish in the Iowa caucuses and endorsed Donald Trump.

""There is no path for me to be the next president absent things that we don't want to see happen in this country,"" he told supporters in Iowa on Monday.

He added that he had spoken to Mr Trump and planned to campaign for him.

His departure further narrows down the field dominated by the ex-president.

On Monday night, Donald Trump finished with an overwhelming lead in Iowa, followed by Florida Governor Ron DeSantis in second and former UN Ambassador Nikki Haley in third.

Mr Ramaswamy, who finished in the fourth place, was the only candidate of the night to announce his departure from the race after Iowa held its first-in-the-nation vote.

He pledged to put ""an America first candidate in the White House"" and said that he planned to appear at a Trump campaign rally in New Hampshire in the coming days.

""Now, going forward, he will have my full endorsement for the presidency. And I think we're going to do the right thing for this country,"" he said.

""And so I'm going to ask you, to follow me in taking our America First movement to the next level.""

The Harvard and Yale-educated son of Indian immigrants entered the race after making his fortune in the pharmaceutical industry.

The 38-year-old has never held political office and his campaign has at times courted controversy for its endorsement of conspiracy theories.

He promised to end birth-right citizenship and affirmative action and said he would close the Education Department, the Federal Bureau of Investigation, the Internal Revenue Service and other government agencies.

He positioned himself as an outsider willing to develop former President Trump's ""America First"" agenda with his own personal spin. But his campaign was unable to pull much support away from Mr Trump.

Just before Iowa's caucus, Mr Trump offered a rare criticism of Mr Ramaswamy, calling him a ""fraud"" and telling Republicans that a vote for him would be a vote for the ""other side"".

Mr Trump had previously praised the Ohio-native, posting after the fourth Republican debate in December: ""Vivek WINS because he thinks l'm great.""

Mr Ramaswamy has been a steadfast defender of Mr Trump's record on the campaign trail, including after Mr Trump's pre-Iowa attack.","Iowa caucuses 2024: Vivek Ramaswamy suspends campaign and endorses TrumpBy Max Matza BBC NewsReutersEntrepreneur Vivek Ramaswamy has dropped out of the presidential race after a disappointing finish in the Iowa caucuses and endorsed Donald Trump.
He added that he had spoken to Mr Trump and planned to campaign for him.
He positioned himself as an outsider willing to develop former President Trump's ""America First"" agenda with his own personal spin.
Mr Trump had previously praised the Ohio-native, posting after the fourth Republican debate in December: ""Vivek WINS because he thinks l'm great.""
Mr Ramaswamy has been a steadfast defender of Mr Trump's record on the campaign trail, including after Mr Trump's pre-Iowa attack."
https://www.bbc.com/news/world-us-canada-67951955,The Iowa caucuses... a dramatic night in 82 seconds,['Author not found'],"Copyright 2024 BBC. All rights reserved. The BBC is not responsible for the content of external sites. Read about our approach to external linking.

Beta Terms By using the Beta Site, you agree that such use is at your own risk and you know that the Beta Site may include known or unknown bugs or errors, that we have no obligation to make this Beta Site available with or without charge for any period of time, nor to make it available at all, and that nothing in these Beta Terms or your use of the Beta Site creates any employment relationship between you and us. The Beta Site is provided on an “as is” and “as available” basis and we make no warranty to you of any kind, express or implied.

In case of conflict between these Beta Terms and the BBC Terms of Use these Beta Terms shall prevail.","Copyright 2024 BBC.
The BBC is not responsible for the content of external sites.
Read about our approach to external linking.
The Beta Site is provided on an “as is” and “as available” basis and we make no warranty to you of any kind, express or implied.
In case of conflict between these Beta Terms and the BBC Terms of Use these Beta Terms shall prevail."
https://www.bbc.co.uk/sounds/play/p0h572yl,Americast - Trump Wins Iowa Landslide - BBC Sounds,['Author not found'],,
https://www.bbc.com/news/world-middle-east-67992600,Red Sea attacks: Greek vessel hit by missile - reports,['Author not found'],"Red Sea attacks: Greek vessel hit by missile - reports

By Kathryn Armstrong BBC News

Getty Images

Dozens of vessels have been targeted by the Houthis in the Red Sea since November

A Malta-flagged, Greek-owned vessel has been hit with a missile in the Red Sea off the coast of Yemen, maritime security firm Ambrey has said.

It is thought to be the third incident involving the bulk carrier, believed to be named Zografia, in 24 hours.

Tuesday's incident comes as the US military announced it had seized Iranian-supplied weapons bound for the Houthis during an operation last week.

Meanwhile, the US has hit more targets in Houthi-controlled areas of Yemen.

An official told CBS, the BBC's American partner, that the US conducted further strikes on Houthi positions overnight.

The US and UK launched a wave of airstrikes against dozens of Houthi targets on 11 January following attacks by the Iran-backed group on shipping in the Red Sea.

It is not yet known what was attacked in the latest US operation.

The Houthis have vowed to retaliate and on Sunday the US said it had shot down a missile fired towards one of its warships from a Houthi area of Yemen.

Several vessels have been targeted by the movement's fighters since November in protest at Israel's war with Hamas.

The Houthis say they are targeting vessels which are Israeli-owned, flagged or operated, or are heading to Israeli ports. However, many have no connections with Israel.

The Red Sea connects the Indian Ocean to the Mediterranean via the Suez Canal but several shipping lines have announced they are now diverting round the Cape of Good Hope to reach Europe instead.

US Central Command

The US said on Tuesday that analysis from the weapons it seized from a ship near the Yemen coast suggested the Houthis had been using the same kind of weapons in their Red Sea attacks.

The seizure took place on 11 January near the coast of Somalia - the same day as the first US-UK airstrikes.

Cruise and ballistic missile components were among the items found on a ship, as well as parts for air defence equipment.

""This is the first seizure of lethal, Iranian-supplied advanced conventional weapons (ACW) to the Houthis since the beginning of Houthi attacks against merchant ships in November 2023,"" US Central Command said in a statement.

It also said a search is continuing for two Navy Seals who were lost overboard during the operation.","Red Sea attacks: Greek vessel hit by missile - reportsBy Kathryn Armstrong BBC NewsGetty ImagesDozens of vessels have been targeted by the Houthis in the Red Sea since NovemberA Malta-flagged, Greek-owned vessel has been hit with a missile in the Red Sea off the coast of Yemen, maritime security firm Ambrey has said.
Tuesday's incident comes as the US military announced it had seized Iranian-supplied weapons bound for the Houthis during an operation last week.
The US and UK launched a wave of airstrikes against dozens of Houthi targets on 11 January following attacks by the Iran-backed group on shipping in the Red Sea.
The Red Sea connects the Indian Ocean to the Mediterranean via the Suez Canal but several shipping lines have announced they are now diverting round the Cape of Good Hope to reach Europe instead.
US Central CommandThe US said on Tuesday that analysis from the weapons it seized from a ship near the Yemen coast suggested the Houthis had been using the same kind of weapons in their Red Sea attacks."
