URL,Title,Authors,Text,TF_IDF_Summary
https://www.bbc.com/news/world-africa-67986196,Nabeeha kidnap: Nigeria's first lady 'devastated' by death of student,['Author not found'],"Nabeeha kidnap: Nigeria's first lady 'devastated' by death of student

By Chris Ewokor & Natasha Booty BBC News, Abuja and London

AFP

First Lady Remi Tinubu admits it is a difficult moment for the nation

Nigeria's first lady has joined the chorus of voices condemning the killing of a student abducted along with her five sisters, calling it a ""devastating loss"".

Nabeeha Al-Kadriyar, 21, was ""super-bright, smart and kind"", her cousin Asiya Adamu told the BBC on Monday.

Nabeeha also loved to write poetry and read books by the American author Jodi Picoult - and she was days away from graduating with a science degree from Ahmadu Bello University.

""On the day the kidnapping happened, I asked Nabeeha if we were going to the [graduation ceremony] together, and she said yes,"" recalls Ms Adamu. It was the last time she saw her alive.

That evening, on 2 January, Nabeeha was abducted along with her father and sisters from their home in the outskirts of the capital, Abuja.

Nigerian police have not confirmed what happened next. Witnesses say Nabeeha's uncle ran to find help but was ambushed and killed, as were three police officers. It is not known why the family was targeted.

The kidnappers demanded to be paid a huge sum of cash by 12 January, and when they did not get it they killed Nabeeha as a warning, according to a member of the family who spoke to the BBC on condition of anonymity.

Nabeeha's kidnappers handed over her body and, in accordance with Islamic rites, she was swiftly buried by her family on Saturday.

A national reckoning

News of Nabeeha's plight began to circulate over the weekend, prompting widespread grief and indignation that Nigeria's kidnapping crisis rages on despite government promises to bring it to an end.

This moment of reckoning has moved the president's wife to speak out and confirm Nabeeha's death, even though police had not yet officially done so.

Security agencies must ""intensify their efforts"" to end Nigeria's kidnapping and security crisis, said First Lady Remi Tinubu on Monday, demanding a ""swift return of the Al-Kadriyar sisters"".

Their father Mansoor Al-Kadriyar, who was freed days ago in order to fetch the ransom money, now faces an agonising wait for their return. His daughters' captors are demanding a higher sum of 65m naira ($68,000; £53,000), to be paid by Wednesday.

Hundreds of Nigerians have been kidnapped for ransom in recent years, largely by criminal gangs who see it as an easy way to make money. Close to 20 people were abducted in in the first week of 2024 alone.

No matter how desperate the circumstances, Nigerian law prohibits the payment of ransom money. However, many victims pay up because they do not trust authorities or their track record.

Even a former minister appears to share this scepticism of the Nigerian state's ability to bring the abducted back.

""I am personally not in support of paying ransom to criminals. However... I spoke with a friend who offered to pay the remaining 50 million naira,"" says ex-Digital Economy Minister Isa Ali Pantami, who is now a professor in cybersecurity, and a Muslim cleric.

He was one of the architects of the policy of registering all mobile phone Sim cards, in order to make life harder for kidnappers and extortionists, but says he is ""frustrated"" that it has not been better implemented despite allegedly enduring ""threats to my life"".

Nabeeha's cousin, Asiya Adamu, has also crowdfunded money from well-wishers online to help pay the ransom. She did not respond to the BBC's request to disclose the total raised, saying security officers had advised her not to so.

While she prays for the safe return of the rest of her cousins, Ms Adamu is haunted by the thought that she narrowly avoided the same fate. She tells the BBC she was due to spend time at their house that day but later changed her mind.

""My favourite memories of Nabeeha was mostly when we were in the kitchen together,"" Ms Adamu recalls.

""Losing her has left a void one cannot explain with words. She was a source of comfort and understanding and I've lost that,"" she adds.

""She had plans of going to Morocco for her Masters because she liked the place.

""I guess we make plans and Allah has the last word.""

You may also be interested in:","Nabeeha kidnap: Nigeria's first lady 'devastated' by death of studentBy Chris Ewokor & Natasha Booty BBC News, Abuja and LondonAFPFirst Lady Remi Tinubu admits it is a difficult moment for the nationNigeria's first lady has joined the chorus of voices condemning the killing of a student abducted along with her five sisters, calling it a ""devastating loss"".
Nabeeha Al-Kadriyar, 21, was ""super-bright, smart and kind"", her cousin Asiya Adamu told the BBC on Monday.
That evening, on 2 January, Nabeeha was abducted along with her father and sisters from their home in the outskirts of the capital, Abuja.
Their father Mansoor Al-Kadriyar, who was freed days ago in order to fetch the ransom money, now faces an agonising wait for their return.
No matter how desperate the circumstances, Nigerian law prohibits the payment of ransom money."
https://www.bbc.com/news/world-europe-67976277,Frederik X kisses wife as he becomes King of Denmark,['Author not found'],"Copyright 2024 BBC. All rights reserved. The BBC is not responsible for the content of external sites. Read about our approach to external linking.

Beta Terms By using the Beta Site, you agree that such use is at your own risk and you know that the Beta Site may include known or unknown bugs or errors, that we have no obligation to make this Beta Site available with or without charge for any period of time, nor to make it available at all, and that nothing in these Beta Terms or your use of the Beta Site creates any employment relationship between you and us. The Beta Site is provided on an “as is” and “as available” basis and we make no warranty to you of any kind, express or implied.

In case of conflict between these Beta Terms and the BBC Terms of Use these Beta Terms shall prevail.","Copyright 2024 BBC.
The BBC is not responsible for the content of external sites.
Read about our approach to external linking.
The Beta Site is provided on an “as is” and “as available” basis and we make no warranty to you of any kind, express or implied.
In case of conflict between these Beta Terms and the BBC Terms of Use these Beta Terms shall prevail."
https://www.bbc.com/news/uk-scotland-glasgow-west-67949149,"Weight-loss surgeon told patient to 'eat, eat, eat'",['Author not found'],"Weight-loss surgeon told patient to 'eat, eat, eat'

By Catriona MacPhee & Rachel Coburn BBC Disclosure

Undercover footage shows a surgeon telling a reporter she could qualify for gastric sleeve surgery if she ate more

A Turkish doctor selling weight-loss ""holidays"" abroad told an undercover BBC reporter to gain weight so she could have gastric sleeve surgery.

Dr Ogün Erşen told the reporter to ""eat some snacks"" so she could increase her body mass index (BMI) to qualify for his weight loss surgery.

The BBC reporter had a BMI of 24.4, which is within the healthy weight range.

""You must eat, eat. Eat something and reach 30,"" Dr Ersen said.

The reporter gave the weight-loss clinic information which would have meant her BMI was 29 but she was not weighed and no medical checks were carried out during her consultation.

Instead, Dr Erşen offered to book her in for surgery in three months' time and told her to try to put on weight.

A health expert told the BBC it was completely unethical to push a patient to gain weight to hit the threshold for surgery.

He stressed the risks of this irreversible surgery and said it should not be done if it is not needed.

Cosmedacare

Bariatric surgery, also known as weight-loss surgery, is used to treat people who are dangerously obese

Referrals to weight management services in Scotland are up 96% compared to pre-pandemic levels and waiting lists for bariatric surgery on the NHS can exceed four years in some areas.

The price to have it done privately in the UK is between £10,000 and £15,000 but it can cost as little as £2,000 to book weight-loss surgery in Turkey.

However, a BBC Disclosure investigation has uncovered the unethical practices used by some companies offering cheap weight-loss ""holidays"" abroad.

Ekol Hospitals is one of the many Turkish companies targeting British customers. It regularly holds sales days in cities across the UK.

Undercover filming at a sales day in Glasgow revealed Ekol accepting patients whose BMI did not meet the criteria for bariatric surgery.

BMI is based on a person's height and weight and it is one of the main factors when assessing for bariatric surgery.

A patient with a BMI of less than 40, and no severe co-morbidities relating to obesity, would typically be rejected for weight-loss surgery in the UK.

Under the international IFSO guidelines the threshold is lower, at 35.

What is bariatric surgery?

Bariatric surgery, also known as weight-loss surgery, is used by the NHS as a last resort to treat people who are dangerously obese (having a body mass index of 40 or above or 35 plus other obesity-related health conditions).

Patients must have tried and failed to achieve clinically-beneficial weight loss by all other appropriate non-surgical methods and be fit for surgery.

The two most common types of weight loss surgery are:

Sleeve gastrectomy or gastric bypass , where some of the stomach is removed or the digestive system is re-routed past most of the stomach

, where some of the stomach is removed or the digestive system is re-routed past most of the stomach Gastric band, where a band is used to reduce the size of the stomach so a smaller amount of food is required to make someone feel full

At the Ekol sales day, two undercover journalists falsely presented medical information which should have ruled them out

They said their BMIs were 29 and 33 - and one cited depression, all of which should have raised red flags with the consultant.

An Ekol sales rep also encouraged the reporter to eat more and return for surgery at a later date.

The sales rep said: ""I yo-yo dieted my whole life, for 30 years, and I got my sleeve two years ago.""

She added: ""Do you look into more traditional ways, and risk that yo-yo? Or do you just let it go for a few months and eat like a pig? High fat, high calorie, high everything.""

In a statement, Ekol Hospitals said: ""We completely refute the suggestion that our hospital accepts patients for surgeries who do not meet international guidelines or criteria.

""Whilst at the hospital, a full and extensive health check is completed.""

When later asked for a response, the sales rep said: ""It is unfortunate that our health care, NHS or private, is unable to cope with the obesity epidemic in our country, ideally every person would have access to the health care they need but that is not the case.""

Dr Erşen denied he made the comments encouraging a patient to gain weight.

Omar Khan, a consultant bariatric surgeon, said he had concerns over the consultation

Omar Khan, a consultant bariatric surgeon and chairman of the National Bariatric Surgery Registry, described the consultation as ""utterly indefensible"".

He said: ""I have major concerns. It seems that he's almost pushing the patient to hit the target so that they can do the surgery and that's completely unethical.

""There's no surgery which is risk free. What we have to do is balance those risks against potential benefits of weight loss surgery.

""If you take someone who is thin, there's no point in giving them weight loss surgery, because they'll take all of the risks of surgery, but none of the benefits.""

Gill Baird, who runs a cosmetic surgery business in Glasgow, says she regularly turns people away for weight-loss surgery because they do not meet the criteria.

Gill Baird says she regularly turns people away for weight-loss surgery

She said: ""We check for stones in your pockets when you come to the scales.

""We've had patients come in with anoraks on and you'll find that they've got weights in their pockets trying to make themselves heavier. It happens quite a lot.

""They do it because they're desperate, and I can understand that. But they're not understanding the risks that they're taking with their health.""

For some British patients the consequences of going abroad have been fatal.

""Unfortunately, we recently had a situation with a patient from the UK who had inquired with us about a particular procedure,"" Ms Baird said.

""She didn't meet the criteria. We had advised her of that and she told me on the phone that she was going to see a provider who was based abroad the very next day.

""Unfortunately a few weeks later it was in the headlines that she'd sadly passed away as a result of that surgery abroad, which was difficult to process.""","Weight-loss surgeon told patient to 'eat, eat, eat'By Catriona MacPhee & Rachel Coburn BBC DisclosureUndercover footage shows a surgeon telling a reporter she could qualify for gastric sleeve surgery if she ate moreA Turkish doctor selling weight-loss ""holidays"" abroad told an undercover BBC reporter to gain weight so she could have gastric sleeve surgery.
""You must eat, eat.
A patient with a BMI of less than 40, and no severe co-morbidities relating to obesity, would typically be rejected for weight-loss surgery in the UK.
Omar Khan, a consultant bariatric surgeon, said he had concerns over the consultationOmar Khan, a consultant bariatric surgeon and chairman of the National Bariatric Surgery Registry, described the consultation as ""utterly indefensible"".
Gill Baird, who runs a cosmetic surgery business in Glasgow, says she regularly turns people away for weight-loss surgery because they do not meet the criteria."
https://www.bbc.com/news/world-asia-67978183,Zayn Malik: Fans rejoice at ex-One Direction member's Urdu single,['Author not found'],"Zayn Malik: Fans rejoice at ex-One Direction member's Urdu single

By Kelly Ng BBC News

Getty Images

The British singer is fluent in Urdu

Zayn Malik's collaboration with popular Pakistani band Aur has given fans much to celebrate - with many psyched that the British singer is fluent in Urdu.

A remake of Aur's breakout hit Tu Hai Kahan features the ex-One Direction singer providing vocals in Urdu.

The original version of the song has more than 95m views though the remake, released last Friday, is fast catching up, with 3m views.

Malik said he was ""incredibly humbled"" when Aur reached out to him.

""I love the song and have brought some of myself to it. I hope people love what we've done,"" he said.

The 31-year-old was born in Bradford, England, but his father is a Pakistani immigrant to the UK.

The song was quick to gain fans online - with some social media users urging Malik to release ""more Urdu songs please"".

""Some languages just make you feel things... I hope [Zayn] does more fully Urdu songs,"" said one user on X.

Many Urdu speaking fans also celebrated the track, with one calling it a ""gift for his fellow Pakistanis"".

""Desi girls, wake up, Zayn Malik's one Urdu verse literally changed our lives,"" another X user chimed in.

Malik's music career began in 2010 as part of One Direction, a boy band formed on British TV music competition, The X Factor. He released his debut album, Mind of Mine, in 2016. A song in his 2021 album, Nobody is Listening, also included Urdu lyrics.

Aur, which comprises three members Ahad, Usama, and Raffey, said the collaboration shows that ""music has no boundaries"".

""We're taking Pakistani music global, and we can't wait for the world to vibe to our music,"" Aur said.","Zayn Malik: Fans rejoice at ex-One Direction member's Urdu singleBy Kelly Ng BBC NewsGetty ImagesThe British singer is fluent in UrduZayn Malik's collaboration with popular Pakistani band Aur has given fans much to celebrate - with many psyched that the British singer is fluent in Urdu.
A remake of Aur's breakout hit Tu Hai Kahan features the ex-One Direction singer providing vocals in Urdu.
The song was quick to gain fans online - with some social media users urging Malik to release ""more Urdu songs please"".
Many Urdu speaking fans also celebrated the track, with one calling it a ""gift for his fellow Pakistanis"".
""We're taking Pakistani music global, and we can't wait for the world to vibe to our music,"" Aur said."
https://www.bbc.com/news/uk-england-london-67979591,Man in court over plot to disrupt London Stock Exchange,['Author not found'],"Man in court over plot to disrupt London Stock Exchange

Getty Images

The London Stock Exchange is based at Paternoster Square, close to St Paul's Cathedral

A man has appeared in court charged in relation to plans to disrupt the London Stock Exchange.

Sean Middleborough, 31, of Woodlee Road, Liverpool, appeared at Wirral Magistrates' Court charged with conspiracy to cause a public nuisance.

The defendant, wearing a grey tracksuit, spoke to confirm his name, age and address.

Five others were arrested in London, Liverpool and Brighton on Sunday.

Mr Middleborough was remanded in custody until 12 February, when he will appear at Suffolk Crown Court for a plea and trial preparation hearing.

Activists from the group Palestine Action were allegedly plotting to target the London Stock Exchange on Monday, the Met said.

The force said activists had been planning to stop the exchange from opening for trading by ""locking on"" to the building, and causing damage.

The Met said there was a ""suggestion that this was one part of a planned week of action"".

The arrests were prompted by information shared by the Daily Express.

Speaking on Sunday, Det Supt Sian Thomas described the arrests as ""significant"".

A woman, 29, from Brent in north London, a 23-year-old man from Tower Hamlets in east London, two women, aged 28 and 26, from Liverpool, and a 27-year-old man who was arrested in Brighton have been bailed pending further inquiries.","Man in court over plot to disrupt London Stock ExchangeGetty ImagesThe London Stock Exchange is based at Paternoster Square, close to St Paul's CathedralA man has appeared in court charged in relation to plans to disrupt the London Stock Exchange.
Sean Middleborough, 31, of Woodlee Road, Liverpool, appeared at Wirral Magistrates' Court charged with conspiracy to cause a public nuisance.
Five others were arrested in London, Liverpool and Brighton on Sunday.
Activists from the group Palestine Action were allegedly plotting to target the London Stock Exchange on Monday, the Met said.
A woman, 29, from Brent in north London, a 23-year-old man from Tower Hamlets in east London, two women, aged 28 and 26, from Liverpool, and a 27-year-old man who was arrested in Brighton have been bailed pending further inquiries."
https://www.bbc.com/news/business-67977967,"AI to hit 40% of jobs and worsen inequality, IMF says",['Author not found'],"AI to hit 40% of jobs and worsen inequality, IMF says

By Annabelle Liang Business reporter

Getty Images

Artificial intelligence is set to affect nearly 40% of all jobs, according to a new analysis by the International Monetary Fund (IMF).

IMF's managing director Kristalina Georgieva says ""in most scenarios, AI will likely worsen overall inequality"".

Ms Georgieva adds that policymakers should address the ""troubling trend"" to ""prevent the technology from further stoking social tensions"".

The proliferation of AI has put its benefits and risks under the spotlight.

The IMF said AI is likely to affect a greater proportion of jobs - put at around 60% - in advanced economies. In half of these instances, workers can expect to benefit from the integration of AI, which will enhance their productivity.

In other instances, AI will have the ability to perform key tasks that are currently executed by humans. This could lower demand for labour, affecting wages and even eradicating jobs.

Meanwhile, the IMF projects that the technology will affect just 26% of jobs in low-income countries.

It echoes a report from Goldman Sachs in 2023, which estimated AI could replace the equivalent of 300 million full-time jobs - but said there may also be new jobs alongside a boom in productivity.

Ms Georgieva said ""many of these countries don't have the infrastructure or skilled workforces to harness the benefits of AI, raising the risk that over time the technology could worsen inequality among nations"".

More generally, higher-income and younger workers may see a disproportionate increase in their wages after adopting AI.

Lower-income and older workers could fall behind, the IMF believes.

""It is crucial for countries to establish comprehensive social safety nets and offer retraining programmes for vulnerable workers,"" Ms Georgieva said. ""In doing so, we can make the AI transition more inclusive, protecting livelihoods and curbing inequality.""

The IMF analysis comes as global business and political leaders gather at the World Economic Forum in Davos, Switzerland.

AI is a topic of discussion, following the surge in popularity of applications like ChatGPT.

The technology is facing increased regulation around the world. Last month, European Union officials reached a provisional deal on the world's first comprehensive laws to regulate the use of AI.

China has introduced some of the world's first national regulations on AI, which include rules concerning how algorithms can be developed and deployed.

In October, President Biden signed an executive order compelling developers to share safety results relating to AI with the US government.","AI to hit 40% of jobs and worsen inequality, IMF saysBy Annabelle Liang Business reporterGetty ImagesArtificial intelligence is set to affect nearly 40% of all jobs, according to a new analysis by the International Monetary Fund (IMF).
IMF's managing director Kristalina Georgieva says ""in most scenarios, AI will likely worsen overall inequality"".
The IMF said AI is likely to affect a greater proportion of jobs - put at around 60% - in advanced economies.
In half of these instances, workers can expect to benefit from the integration of AI, which will enhance their productivity.
Meanwhile, the IMF projects that the technology will affect just 26% of jobs in low-income countries."
https://www.bbc.com/news/entertainment-arts-67989266,"Selena Gomez, Jenna Ortega and more walk red carpet at Emmy Awards",['Author not found'],"Copyright 2024 BBC. All rights reserved. The BBC is not responsible for the content of external sites. Read about our approach to external linking.

Beta Terms By using the Beta Site, you agree that such use is at your own risk and you know that the Beta Site may include known or unknown bugs or errors, that we have no obligation to make this Beta Site available with or without charge for any period of time, nor to make it available at all, and that nothing in these Beta Terms or your use of the Beta Site creates any employment relationship between you and us. The Beta Site is provided on an “as is” and “as available” basis and we make no warranty to you of any kind, express or implied.

In case of conflict between these Beta Terms and the BBC Terms of Use these Beta Terms shall prevail.","Copyright 2024 BBC.
The BBC is not responsible for the content of external sites.
Read about our approach to external linking.
The Beta Site is provided on an “as is” and “as available” basis and we make no warranty to you of any kind, express or implied.
In case of conflict between these Beta Terms and the BBC Terms of Use these Beta Terms shall prevail."
